pub_date,authors,title,venue,url_slug,paper_url,tag,code_url,extra_links,doi
2026-05-01,"Hanmei Yang, Jin Zhou, Yao Fu, Xiaoquan Wang, Ramine Roane, Hui Guan, Tongping Liu",ProTrain: Efficient LLM Training via Automatic Memory Management,"The 9th Annual Conference on Machine Learning and Systems (MLSys 2026), Bellevue, WA, May 18-22, 2026",mlsys26-protrain-efficient,https://arxiv.org/pdf/2406.08334,MLSys'26,,,
2026-11-01,"Mohammad Mehdi Rastikerdar, Jin Huang, Hui Guan, Deepak Ganesan",WildFiT: Autonomous In-situ Model Adaptation for Resource-Constrained IoT Systems,"ACM/IEEE International Conference on Embedded Artificial Intelligence and Sensing Systems, 2026",sensys26-wildfit-autonomous,,SenSys'26,,,
2026-04-01,"Kylie Lin, Hui Guan, David N Rapp, Cindy Xiong Bearfield",A Four-Stage Framework of Visual Complexity and Trust as Mediated by Effort,"IEEE Pacific Visualization Conference, 2026",pacificvis26-fourstage-framework,,PacificVis'26,,,
2026-03-01,"Kunjal Panchal, Saayan Mitra, Somdeb Sarkhel, Haoliang Wang, Ishita Dasgupta, Gang Wu, Hui Guan",Atom: Efficient On-Device Video-Language Pipelines Through Modular Reuse,"ACM Multimedia Systems Conference, 2026",mmsys26-atom-efficient,https://arxiv.org/pdf/2512.17108,MMSys'26,,,
2025-08-01,"Saurabh Bajaj, Hojae Son, Juelin Liu, Hui Guan, and Marco Serafini",Graph neural network training systems: A performance comparison of full-graph and mini-batch,"Proceedings of the VLDB Endowment, 2025",vldb25-graph-neural,https://arxiv.org/pdf/2406.00552,VLDB'25,,,
2025-07-01,"Lijun Zhang, Xiao Liu, Hui Guan",Reimagining Parameter Space Exploration with Diffusion Models,First Exploration in AI Today Workshop at ICML (EXAIT at ICML 2025),exaiticml25-reimagining-parameter,https://arxiv.org/pdf/2506.17807,EXAIT@ICML'25,,,
2025-06-01,"Lijun Zhang, Xiao Liu, Kaleel Mahmood, Caiwen Ding, and Hui Guan",Attacking all tasks at once using adversarial examples in multi-task learning,"Neurocomputing, 2025",neurocomputing25-attacking-all,https://www.sciencedirect.com/science/article/abs/pii/S0925231225021757?via%3Dihub,Neurocomputing'25,,,
2025-06-01,"Hanmei Yang, Summer Deng, Amit Nagpal, Maxim Naumov, Mohammad Janani, Tongping Liu, Hui Guan",An Empirical Study of Microscaling Formats for Low-Precision LLM Training,"32nd IEEE Symposium on Computer Arithmetic, Jun 23-25, 2025",arith25-empirical-study,https://www.computer.org/csdl/proceedings-article/arith/2025/215900a001/27Rt0ovaONW,ARITH'25,,,
2025-06-01,"Hui Guan, Umang Chaudhary, Yuanchao Xu, Lin Ning, Lijun Zhang, Xipeng Shen",Recurrent Neural Networks Meet Context-Free Grammar: Two Birds with One Stone,"ACM Transactions on Knowledge Discovery from Data, Volume 20, Issue 2, 2025",tkdd25-recurrent-neural,https://dl.acm.org/doi/10.1145/3785464,TKDD'25,,,
2025-05-01,"Sandeep Polisetty, Juelin Liu, Yi Fung, Seung-Hwan Lim, Hui Guan, Marco Serafini",SPA: Scaling Graph Neural Network Training on Large Graphs via Probablistic Splitting,"The Eighth Annual Conference on Machine Learning and Systems, Santa Clara, May 12-15, 2025 (Acceptance Rate = 22% (61/271))",mlsys25-spa-scaling,http://guanh01.github.io/files/2025gsplit.pdf,MLSys'25,,,
2025-05-01,"Sohaib Ahmad (co-first author), Qizheng Yang (co-first author), Haoliang Wang, Ramesh K. Sitaraman, and Hui Guan",DiffServe: Efficiently Serving Text-to-Image Diffusion Models with Query-Aware Model Scaling,"The Eighth Annual Conference on Machine Learning and Systems, Santa Clara, May 12-15, 2025. (Acceptance Rate = 22% (61/271))",mlsys25-diffserve-efficiently,https://arxiv.org/pdf/2411.15381,MLSys'25,,,
2025-05-01,"Kylie Lin, Sean Sheng-tse Ru, David N Rapp, Hui Guan, Cindy Xiong Bearfield",What Makes a Visualization Visually Complex?,"Extended Abstracts of the CHI Conference on Human Factors in Computing Systems, 2025",chiea25-what-makes,https://dl.acm.org/doi/abs/10.1145/3706599.3719983,CHI EA'25,,,
2024-12-01,"Jin Zhou, Hanmei Yang, Steven Jiaxun Tang, Mingcan Xiang, Hui Guan, Tongping Liu",Understanding and Alleviating Memory Issue in RLHF for LLMs,"NeurIPS'24 Workshop MLforSys, Dec 14, 2024, Vancouver",mlforsysneurips24-understanding-alleviating,https://openreview.net/pdf?id=Hldy0yDrr1,MLforSys@NeurIPS'24,,,
2024-12-01,"Siqi Chen, Zhiqiang Wang, Xianqi Deng, Yili Shen, Cheng-Wei Ju, Jun Yi, Lin Xiong, Guo Ling, Dieaa Alhmoud, Hui Guan, Zhou Lin",Integrating Graph Neural Networks and Many-Body Expansion Theory for Potential Energy Surfaces,"NeurIPS'24 Workshop AI4Mat, Dec 15, 2024, Vancouver",ai4matneurips24-integrating-graph,https://openreview.net/pdf?id=ra3CxVuhUf,AI4Mat@NeurIPS'24,,,
2024-12-01,"Lijun Zhang, Xiao Liu, Antoni Viros i Martin, Cindy Xiong Bearfield, Yuriy Brun, Hui Guan",Attack-Resilient Image Watermarking Using Stable Diffusion,"NeurIPS '24, Mon, Dec 9, 2024 – Sun, Dec 15, 2024, Vancouver",neurips24-attackresilient-image,http://guanh01.github.io/files/2024zodiac.pdf,NeurIPS'24,https://github.com/zhanglijun95/ZoDiac,,
2024-12-01,"Kunjal Panchal, Nisarg Parikh, Sunav Choudhary, Lijun Zhang, Yuriy Brun, Hui Guan",Thinking Forward: Memory-Efficient Federated Finetuning of Language Models,"NeurIPS '24, Mon, Dec 9, 2024 – Sun, Dec 15, 2024, Vancouver",neurips24-thinking-forward,http://guanh01.github.io/files/2024spry.pdf,NeurIPS'24,https://github.com/Astuary/Spry,,
2024-10-01,"Mingcan Xiang, Jiaxun Tang, Qizheng Yang, Hui Guan, Tongping Liu",AdapMTL: Adaptive Pruning Framework for Multitask Learning Model,"ACM MM '24, October 28-November 1, 2024, Melbourne, VIC, Australia",acmmm24-adapmtl-adaptive,https://arxiv.org/pdf/2408.03913,ACM MM'24,,,https://doi.org/10.1145/3664647.3681426
2024-08-01,"Siddhant Garg, Lijun Zhang, Hui Guan",Structured Pruning for Multi-Task Deep Neural Networks,"International Conference on Multimedia Information Processing and Retrieval, August 07, 2024",mipr24-structured-pruning,https://arxiv.org/pdf/2304.06840,MIPR'24,,,
2024-06-01,"Xiao Liu, Lijun Zhang, Hui Guan",Information-Enhanced Graph Neural Network for Transcending Homophily Barriers,"In IEEE Access, 2024",ieeeaccess24-informationenhanced-graph,https://ieeexplore.ieee.org/stamp/stamp.jsp?arnumber=10810421,IEEE Access'24,,,
2024-06-01,"Mohammad Mehdi Rastikerdar, Jin Huang, Shiwei Fang, Hui Guan, Deepak Ganesan",CACTUS: Dynamically Switchable Context-aware micro-Classifiers for Efficient IoT Inference,"The 22nd ACM International Conference on Mobile Systems, Applications, and Services (MobiSys), Tokyo, Japan, June 3-7, 2024",mobisys24-cactus-dynamically,http://guanh01.github.io/files/2024mobisys-cactus.pdf,MobiSys'24,https://github.com/mmehdirk/CACTUS-Dynamically-Switchable-Context-aware-micro-Classifiers-for-Efficient-IoT-Inference,,https://doi.org/10.1145/3643832.3661888
2024-06-01,"Sohaib Ahmad, Hui Guan, Ramesh K. Sitaraman",Loki: A System for Serving ML Inference Pipelines with Hardware and Accuracy Scaling,"The 33rd International Symposium on High-Performance Parallel and Distributed Computing (HPDC'24), Pisa, Italy, June 3-7, 2024. (Acceptance Rate = 17% (26/152))",hpdc24-loki-system,http://guanh01.github.io/files/2024hpdc-loki.pdf,HPDC'24,,,
2024-04-01,"Qizheng Yang, Tianyi Yang, Mingcan Xiang, Lijun Zhang, Haoliang Wang, Marco Serafini, Hui Guan",GMorph: Accelerating Multi-DNN Inference via Model Fusion,"The 2024 European Conference on Computer Systems (EuroSys), April 22-25, 2024",eurosys24-gmorph-accelerating,http://guanh01.github.io/files/2024eurosys-gmorph.pdf,EuroSys'24,https://github.com/qizhengyang98/GMorph/tree/master,,https://doi.org/10.1145/3627703.3650074
2024-04-01,"Sohaib Ahmad, Hui Guan, Brain D. Friedman, Thomas Williams, Ramesh K. Sitaraman, Thomas Woo",Proteus: A High-Throughput Inference-Serving System with Accuracy Scaling,"The 2024 ACM Conference on Architectural Support for Programming Languages and Operating Systems, April 27-May 1, 2024",asplos24-proteus-highthroughput,http://guanh01.github.io/files/2024proteus.pdf,ASPLOS'24,https://github.com/UMass-LIDS/Proteus,,https://doi.org/10.1145/3617232.3624849
2023-12-01,"Kunjal Panchal, Sunav Choudhary, Nisarg Parikh, Lijun Zhang, Hui Guan",Flow: Per-instance Personalized Federated Learning,"The 2023 Conference on Neural Information Processing Systems, Dec. 10-16, 2023",neurips23-flow-perinstance,http://guanh01.github.io/files/2023flow.pdf,NeurIPS'23,https://github.com/Astuary/Flow,,
2023-10-01,"Juelin Liu, Sandeep Polisetty, Hui Guan, Marco Serafini",GraphMini: Accelerating Graph Pattern Matching Using Auxiliary Graphs,"The 32nd International Conference on Parallel Architectures and Compilation Techniques, Oct. 21-25, 2023",pact23-graphmini-accelerating,http://guanh01.github.io/files/2023pact-GraphMini.pdf,PACT'23,https://zenodo.org/record/8350579,,
2023-10-01,"Jin Huang, Hui Guan, Deepak Ganesan",Re-thinking computation offload for efficient inference on IoT devices with duty-cycled radios,"The 29th International Conference on Mobile Computing and Networking, Madrid, Spain, Oct. 2-6, 2023",mobicom23-rethinking-computation,http://guanh01.github.io/files/2023mobicom.pdf,MobiCom'23,,,
2023-07-01,"Kunjal Panchal, Sunav Choudhary, Subrata Mitra, Koyel Mukherjee, Somdeb Sarkhel, Saayan Mitra, Hui Guan",Flash: Concept Drift Adaptation in Federated Learning,"40th International Conference on Machine Learning, Jul. 23-29, 2023",icml23-flash-concept,http://guanh01.github.io/files/2023flash.pdf,ICML'23,,,
2023-07-01,"Jinlin Lai, Javier Burroni, Hui Guan, Daniel Sheldon",Automatically marginalized MCMC in probabilistic programming,"40th International Conference on Machine Learning, Jul. 23-29, 2023",icml23-automatically-marginalized,https://arxiv.org/pdf/2302.00564.pdf,ICML'23,,,
2023-06-01,"Lijun Zhang, Xiao Liu, Hui Guan",A Tree-Structured Multi-Task Model Architectures Recommendation System,"IEEE Transactions on Neural Networks and Learning Systems, 2023",tnnls23-treestructured-multitask,https://ieeexplore.ieee.org/document/10171463,TNNLS'23,https://github.com/zhanglijun95/TreeMTL,,
2023-06-01,"Hanmei Yang, Xin Zhao, Jin Zhou, Wei Wang, Sandip Kundu, Bo Wu, Hui Guan, and Tongping Liu",NUMAlloc: A Faster NUMA Memory Allocator,"ACM SIGPLAN International Symposium on Memory Management, 2023",ismm23-numalloc-faster,http://guanh01.github.io/files/2023ismm.pdf,ISMM'23,,,
2023-06-01,"Lijun Zhang, Qizheng Yang, Xiao Liu, Hui Guan",An Alternative Hard-Parameter Sharing Paradigm for Multi-Domain Learning,"In IEEE Access, 2023",ieeeaccess23-alternative-hardparameter,https://ieeexplore.ieee.org/document/10028984,IEEE Access'23,,,
2022-11-01,"Lijun Zhang, Xiao Liu, Hui Guan",AutoMTL: A Programming Framework for Automating Efficient Multi-Task Learning,"36th Conference on Neural Information Processing Systems (NeurIPS 2022), November 28, 2022. (Acceptance rate: 25.6%)",neurips22-automtl-programming,http://guanh01.github.io/files/2022automtl.pdf,NeurIPS'22,https://github.com/zhanglijun95/AutoMTL,,
2022-08-01,"Sian Jin, Chengming Zhang, Xintong Jiang, Yunhe Feng, Hui Guan, Guanpeng Li, Shuaiwen Leon Song, and Dingwen Tao",COMET: A Novel Memory-Efficient Deep Learning Training Framework by Using Error-Bounded Lossy Compression,"In International Conference on Very Large Data Bases, 2022",vldb22-comet-novel,https://arxiv.org/pdf/2111.09562.pdf,VLDB'22,,,
2022-07-01,"Lijun Zhang, Xiao Liu, Hui Guan",A Tree-Structured Multi-Task Model Recommender,"1st International Conference on Automated Machine Learning, July 25-27, 2022. (Acceptance rate: 19.2%)",automl22-treestructured-multitask,http://guanh01.github.io/files/2022automl.pdf,AutoML'22,https://github.com/zhanglijun95/TreeMTL,Teaser~>https://www.youtube.com/watch?v=t9r474WdBEQ|Video~>https://www.youtube.com/watch?v=DobkdkBMFrg,
2022-07-01,"Lijun Zhang, Qizheng Yang, Xiao Liu, Hui Guan",Rethinking Hard-Parameter Sharing in Multi-Domain Learning,"IEEE INTERNATIONAL CONFERENCE ON MULTIMEDIA AND EXPO (ICME), Taipei, Taiwan, July 18-22, 2022. (Acceptance rate: 29%)",icme22-rethinking-hardparameter,http://guanh01.github.io/files/2022rethinking.pdf,ICME'22,,,
2022-07-01,"Yili Shen, Jiaxu Yan, Cheng-Wei Ju, Jun Yi, Zhou Lin, Hui Guan",Improving Subgraph Representation Learning via Multi-View Augmentation,[ICML 2022 AI4Science Workshop](http://ai4science.net/icml22/),ai4scienceicml22-improving-subgraph,https://arxiv.org/pdf/2205.13038.pdf,AI4Science@ICML'22,,talk~>https://slideslive.com/38986179/improving-subgraph-representation-learning-via-multiview-augmentation,
2022-06-01,"Kunjal Panchal, Hui Guan",Flow: Fine-grained Personalized Federated Learning through Dynamic Routing,[CrossFL 2022 Workshop @ MLSys'22](https://crossfl2022.github.io/program/),crossfl22-flow-finegrained,https://crossfl2022.github.io/abstracts/Abstract9.pdf,CrossFL'22,,Poster~>https://crossfl2022.github.io/posters/Poster9.pdf,
2022-04-01,"Zifan Nan, Xipeng Shen, Hui Guan",Enabling Near Real-Time NLU-Driven Natural Language Programming through Dynamic Grammar Graph-Based Translation,"The 2022 International Symposium on Code Generation and Optimization (CGO), Seoul, South Korea, 2022",cgo22-enabling-near,http://guanh01.github.io/files/2022cgo.pdf,CGO'22,,,
2021-12-01,"Hui Guan, Umang Chaudhary, Yuanchao Xu, Lin Ning, Lijun Zhang, and Xipeng Shen",Recurrent Neural Networks Meet Context-Free Grammar: Two Birds with One Stone,"In IEEE International Conference on Data Mining, 2021 (short paper). (Acceptance rate: 20% (198/990))",icdm21-recurrent-neural,http://guanh01.github.io/files/2021rnn.pdf,ICDM'21,,,
2021-06-03,"Marco Serafini, Hui Guan",Scalable Graph Neural Network Training: The Case for Sampling,"In ACM SIGOPS Operating Systems Review, 2021",2021sampling,http://guanh01.github.io/files/2021sampling.pdf,OSR'21,,,
2021-06-01,"Xin Zhao, Jin Zhou, Hui Guan, Wei Wang, Xu Liu, Tongping Liu",NumaPerf: Predictive and Comprehensive NUMA Profiling,"In Proceedings of International Conference on Supercomputing, 2021. (Acceptance rate: 25% (39/157))",ics21-numaperf-predictive,http://guanh01.github.io/files/2021ics.pdf,ICS'21,,,
2021-06-01,"Shaurya Patel, Tongping Liu, Hui Guan",FreeLunch: Compression-based GPU Memory Management for Convolutional Neural Networks,In MCHPC'21 Workshop,mchpc21-freelunch-compressionbased,http://guanh01.github.io/files/2021mchpc.pdf,MCHPC'21,,,
2021-06-01,"Hui Guan, Shaoshan Liu, Xiaolong Ma, Wei Niu, Bin Ren, Xipeng Shen, Yanzhi Wang, Pu Zhao. (Authors in Alphabetical Order)",CoCoPIE: Enabling Real-Time AI on Off-the-Shelf Mobile Devices via Compression-Compilation Co-Design,"In Communications of the ACM, 2021",2021CACM,https://cacm.acm.org/magazines/2021/6/252819-cocopie/fulltext,CACM'21,,,
2021-04-01,"Lijun Zhang, Hui Guan, Yufei Ding, Xipeng Shen, Hamid Krim",Reuse-Centric K-Means Configuration,"Information Systems, 2021",2021kmeans,,InformationSystems'21,,,
2021-01-01,"Zifan Nan, Hui Guan, Xipeng Shen, and Chunhua Liao",Deep NLP-Based Co-Evolvement for Synthesizing Code Analysis from Natural Language,"In The ACM SIGPLAN 2021 International Conference on Compiler Construction, 2021",2021cc,http://guanh01.github.io/files/2021cc.pdf,CC'21,,,
2020-11-01,"Zifan Nan, Hui Guan, Xipeng Shen",HISyn: Human Learning-Inspired Natural Language Programming,"In The ACM Joint European Software Engineering Conference and Symposium on the Foundations of Software Engineering, Sacramento, California, United States, November 2020. (Acceptance rate: 101/360=28%)",2020fse,http://guanh01.github.io/files/2020hisyn.pdf,FSE'20,,,
2020-11-01,"Hui Guan, Xipeng Shen, and Hamid Krim",An Automatic Synthesizer of Advising Tools for High Performance Computing,"In IEEE Transactions on Parallel and Distributed Systems (TPDS), 2020",2020tpds,http://guanh01.github.io/files/2020tpds.pdf,TPDS'20,,,
2020-03-04,"Hui Guan, Laxmikant Kishor Mokadam, Xipeng Shen, Seung-Hwan Lim, Robert Patton",FLEET: Flexible Efficient Ensemble Training for Heterogeneous Deep Neural Networks,MLSys'20. (Acceptance rate: 20.0% (34/170)),2020mlsys,http://guanh01.github.io/files/2020mlsys.pdf,MLSys'20,,,
2019-12-09,"Hui Guan, Lin Ning, Zhen Lin, Xipeng Shen, Huiyang Zhou, and Seung-Hwan Lim",In-Place Zero-Space Memory Protection for CNN,"In Advances in Neural Information Processing Systems, pp. 5735-5744. 2019. (Acceptance rate: 21.2% (1428/6743))",2019nips,https://papers.nips.cc/paper/8810-in-place-zero-space-memory-protection-for-cnn.pdf,NeurIPS'19,,,
2019-12-09,"Hui Guan, Andrey Malevich, Jiyan Yang,  Jongsoo Park, and Hector Yuen",Post-Training 4-bit Quantization on Embedding Tables,"MLSys Workshop on Systems for ML @ NeurIPS, 2019",2019fb,http://guanh01.github.io/files/2019fb.pdf,MLSys@NeurIPS'19,,,
2019-06-11,"Hui Guan, Xipeng Shen, and Seung-Hwan Lim",Wootz: a Compiler-based Framework for Fast CNN Pruning via Composability,"In Proceedings of the 40th ACM SIGPLAN Conference on Programming Language Design and Implementation, pp. 717-730. ACM, 2019. (Acceptance rate: 27.7% (76/274))",2019pldi,http://guanh01.github.io/files/2019pldi.pdf,PLDI'19,,,
2019-06-01,"Lin Ning, Hui Guan, and Xipeng Shen",Adaptive Deep Reuse: Accelerating CNN Training on the Fly,"In 2019 IEEE 35th International Conference on Data Engineering (ICDE), pp. 1538-1549. IEEE, 2019. (Acceptance rate: 18%)",2019icde,http://guanh01.github.io/files/2019icde.pdf,ICDE'19,,,
2018-11-01,"Randall Pittman, Hui Guan, Xipeng Shen, Seung-Hwan Lim, and Robert M. Patton",Exploring Flexible Communications for Streamlining DNN Ensemble Training Pipelines,"In Proceedings of the International Conference for High Performance Computing, Networking, Storage, and Analysis, p. 64. IEEE, 2018. (Acceptance rate: 23%)",2018sc,http://guanh01.github.io/files/2018sc.pdf,SC'18,,,
2018-09-01,"Hui Guan, Yufei Ding, Xipeng Shen, and Hamid Krim",Reuse-Centric K-Means Configuration,"In 2018 IEEE 34th International Conference on Data Engineering (ICDE), pp. 1224-1227. IEEE, 2018. (short paper) (Acceptance rate: 23%)",2018icde,http://guanh01.github.io/files/2018icde.pdf,ICDE'18,,,
2018-02-01,"Yufei Ding, Lin Ning, Hui Guan, Xipeng Shen, Madanlal Musuvathi, Todd Mytkowicz",TOP: A Compiler-Based Framework for Optimizing Machine Learning Algorithms through Generalized Triangle Inequality,"SysML, Feb 16th, 2018, Stanford University, 2018",2018top,http://guanh01.github.io/files/2018top.pdf,SysML'18,,,
2017-11-14,"Hui Guan, Xipeng Shen, and Hamid Krim",Egeria: a Framework for Automatic Synthesis of HPC Advising Tools through Multi-Layered Natural Language Processing,"In Proceedings of the International Conference for High Performance Computing, Networking, Storage and Analysis, p. 10. ACM, 2017. (Acceptance rate: 18% (61/327))",2017sc,http://guanh01.github.io/files/2017sc.pdf,SC'17,,,
2017-01-01,"Yufei Ding, Lin Ning, Hui Guan, and Xipeng Shen",Generalizations of the Theory and Deployment of Triangular Inequality for Compiler-Based Strength Reduction,"In Proceedings of the 38th ACM SIGPLAN Conference on Programming Language Design and Implementation, pp. 33-48. ACM, 2017. (Acceptance rate: 15% (47/322))",2017pldi,http://guanh01.github.io/files/2017pldi.pdf,PLDI'17,,,
2016-06-01,"Hui Guan, Wen Tang, Hamid Krim, James Keiser, Andrew Rindos, and Radmila Sazdanovic",A topological collapse for document summarization,"In 2016 IEEE 17th International Workshop on Signal Processing Advances in Wireless Communications (SPAWC), pp. 1-5. IEEE, 2016",spawc,http://guanh01.github.io/files/2016spawc.pdf,SPAWC'16,,,
